mc500.train.131	didn't Jack's friends say hello to him because His haircut made him look like a different person.	Jack was in the forest.	Jack left his home by Whipple Creek.	didn't Jack's friends say hello to him because Dean the Librarian lost his book.	Willy the Candy Man was the second person Jack met on the way back home.	Dean the Librarian was the second person Jack met on the way back home.	Ichabod the Chief of Police was the second person Jack met on the way back home.	Edward the Barber was the second person Jack met on the way back home.	Jack lives in By Whipple Creek.	Jack lives in In the forest with his friends.	Jack lives in In town.	Jack lives in In a barbershop.	Jack wanted a new look.	Jack was fun getting his hair cut.	Jack really want to get his hair cut because So his friends wouldn't know it was him.	Jack really want to get his hair cut because The Summer Sun was too hot, and his long hair made it worse.
mc500.train.132	Hugo got to Etopit Spaceship.	Hugo got to Etopit Car.	Hugo got to Etopit Plane.	Hugo got to Etopit Sneeze.	the giant orange farm was in Earth.	the giant orange farm was in Tiddlywink.	the giant orange farm was in Rebeti.	the giant orange farm was in Etopit.	Hugo tell the squirrels his was named Rufus.	Hugo tell the squirrels his was named Etopit.	Hugo tell the squirrels his was named Tiddlywink.	Hugo tell the squirrels his was named Xenon.	Hugo traveled to Etopit on 2.	Hugo traveled to Etopit on 2037.	Hugo traveled to Etopit on 7.	Hugo traveled to Etopit on 1032.
mc500.train.133	George and Paul want to eat for lunch Chips.	George and Paul want to eat for lunch Pasta.	George and Paul want to eat for lunch Pizza.	George and Paul want to eat for lunch Burgers and Fries.	Paul picks where they went for lunch.	Ralph picks where they went for lunch.	George picks where they went for lunch.	Sam picks where they went for lunch.	Best Burger has the best burgers, says Paul.	School has the best burgers, says Paul.	Good Burger has the best burgers, says Paul.	Great Burger has the best burgers, says Paul.	George and Paul know each other Best Burger.	George and Paul know each other Great Burger.	George and Paul know each other Lunch period.	George and Paul know each other Fries.
mc500.train.134	Timmy was Bear.	Timmy was Hamster.	Timmy was Tiger.	Timmy was Horse.	Timmy broke Henry's leg.	Bear broke Henry's leg.	Buster broke Henry's leg.	Horse broke Henry's leg.	Hamster is Henry.	Horse is Henry.	Bear is Henry.	Tiger is Henry.	Henry needed from the river Water.	Henry needed from the river Play.	Henry needed from the river Friends.	Henry needed from the river Swim.
mc500.train.135	Tim and Tom are mixed up by others Their names sound alike.	Tim and Tom are mixed up by others They sound alike.	Tim and Tom are mixed up by others They dress alike.	Tim and Tom are mixed up by others They look alike.	Tom warn Tim not to got when it comes to gifts Any board games.	Tom warn Tim not to got when it comes to gifts Any item with dinosaurs included.	Tom warn Tim not to got when it comes to gifts Any item with feathers included.	Tom warn Tim not to got when it comes to gifts Any toy cars.	Tim and his mom not go through to got to the toy aisle Clothing.	Tim and his mom not go through to got to the toy aisle Medicine.	Tim and his mom not go through to got to the toy aisle Jewelry.	Tim and his mom not go through to got to the toy aisle Garden.	Daryl go to Tom's birthday party.	James go to Tom's birthday party.	John go to Tom's birthday party.	Angie go to Tom's birthday party.
mc500.train.136	Fox and Rabbit was not home.	Bear and Goose was not home.	Duck and Turtle was not home.	Bear and Duck was not home.	Rabbit lives next door to Bear.	Duck and Fox lives next door to Bear.	Turtle lives next door to Bear.	Bear lives next door to Bear.	Rabbit was Fox fishing with.	Duck was Fox fishing with.	Turtle was Fox fishing with.	Bear was Fox fishing with.	Fox was Turtle's best friend.	Duck was Turtle's best friend.	Rabbit was Turtle's best friend.	Bear was Turtle's best friend.
mc500.train.137	Lizzie picked for her mother Lizzie picked lilies.	Lizzie picked for her mother Lizzie picked a bird's nest.	Lizzie picked for her mother Lizzie picked a paper cup.	Lizzie picked for her mother Lizzie picked mushrooms.	Lizzie saw at the edge of the pond Lizzie saw a paper cup at the edge of the pond.  Lizzie saw mushrooms at the edge of the pond.	Lizzie saw at the edge of the pond Lizzie saw deer at the edge of the pond.  Lizzie saw flowers at the edge of the pond.	Lizzie saw at the edge of the pond Lizzie saw butterflies at the edge of the pond.  Lizzie saw a bush at the edge of the pond.	Lizzie saw at the edge of the pond Lizzie saw her dog at the edge of the pond.  Lizzie saw her brother at the edge of the pond.	Lizzie dreamed that there was a deer at the edge of the pond and that there were red flowers near the pond.	Lizzie dreamed there were no flowers in the woods. She dreamed it was sunny.	Lizzie dreamed she tripped over a log and hurt her ankle. She dreamed she was going to have to sleep in the woods.	Lizzie dreamed her father found her in the woods. She dreamed she picked mushrooms for her mother.	Lizzie's dog's was name Alice.	Lizzie's dog's was name Lizzie.	Lizzie's dog's was name Daisy.	Lizzie's dog's was name Henry.
mc500.train.138	Jame y looked at before picking one He looked at one of them pets.	Jame y looked at before picking one He looked at four of them pets.	Jame y looked at before picking one He looked at three of them pets.	Jame y looked at before picking one He looked at two of them pets.	Jame y have to promise his parents so he could got a dog Jame y had to promise to only let his mom and dad feed and walk the dog.	Jame y have to promise his parents so he could got a dog Jame y had to promise to pet the dog.	Jame y have to promise his parents so he could got a dog Jame y had to promise to clean up after the dog.	Jame y have to promise his parents so he could got a dog Jame y had to promise to feed and walk the dog.	Jame y not chose the yellow dog because The yellow dog was very noisy.	Jamey did n't want to feed the yellow dog.	Jame y not chose the yellow dog because The yellow dog was too big.	Jamey did n't want to walk the yellow dog.	Jamey saw brown, black, and gray dogs.	Jamey saw yellow, white, and brown dogs.	Jamey saw white, brown and black dogs.	Jamey saw yellow, black and white dogs.
mc500.train.139	the farmer was out doing Walking to the store.	the farmer was out doing Eating bananas at a park.	the farmer was out doing Picking bananas.	the farmer was out doing Singing at a school.	Carol and Jake live in Near train tracks.	Carol and Jake live in In Orangeville.	Carol and Jake live in Next to a school.	Carol and Jake live in Next to a banana farm.	Jake was painful for him to walk.	Jake had trouble carrying all of the bananas.	Jake lean t on Carol because To push her to go to the farm.	Jake felt bad about taking the farmer 's bananas.	Jake was scraped by a nail in the barn.	Jake tripped on a rock and hurt it.	Jake was bit by a dog on his way to school.	Jake was stung by a bee.
mc500.train.140	Kerry normally used the pail to carry grass.	Kerry normally used the pail to carry water.	Kerry normally used the pail to carry frogs.	Kerry normally used the pail to carry sand.	Kerry get a pail full of watered because to walk slowly.	Kerry get a pail full of watered because to play with his airplane.	Kerry get a pail full of watered because to water the grass.	Kerry get a pail full of watered because to put the frog in.	Kerry playing with toys was in at the beach.	Kerry playing with toys was in in the stream.	Kerry playing with toys was in in the house.	Kerry playing with toys was in in the backyard.	Kerry put the frog in the stream because so that the frog could be with its family.	Kerry wanted to save the frog	Kerry wanted it out of the backyard	Kerry put the frog in the stream because so he could go back to playing with his airplane.
mc500.train.141	not fell asleep Brian.	not fell asleep Candace.	not fell asleep Eddie.	not fell asleep David.	Candace and David are the two friends Amy and her brother bring to the beach.	Candace and Eddie are the two friends Amy and her brother bring to the beach.	Eddie and Brian are the two friends Amy and her brother bring to the beach.	Candace and Brian are the two friends Amy and her brother bring to the beach.	Candace brought the blanket they sat on.	Brian brought the blanket they sat on.	Amy's father brought the blanket they sat on.	Amy's mother brought the blanket they sat on.	 Whose family went to the beach Amy's family.	 Whose family went to the beach Candace's family.	 Whose family went to the beach David's family.	 Whose family went to the beach Eddie's Family.
mc500.train.142	the bully's is name Deborah.	the bully's is name Adam.	the bully's is name Pierre.	the bully's is name Mike.	Adam and Deborah sit down to talked in Adam's Classroom.	Adam and Deborah sit down to talked in The Car.	Adam and Deborah sit down to talked in The Grass.	Adam and Deborah sit down to talked in Deborah's Work.	is Deborah's boss different from Adam's bully Deborah's boss can fire Deborah.	is Deborah's boss different from Adam's bully Adam's bully can fire Adam.	is Deborah's boss different from Adam's bully Deborah's boss does not like Deborah.	is Deborah's boss different from Adam's bully Adam cannot ignore the bully.	Deborah upset because The lawn had not been mowed.	Deborah upset because Her new boss is not nice.	Deborah upset because There is a bully in school.	Deborah upset because There were groceries in the car.
mc500.train.143	Max is Farmer.	Max is Human.	Max is Plant.	Max is Reindeer.	Potatoes doesn't Terry get for helping the farmer.	Money doesn't Terry get for helping the farmer.	Carrots doesn't Terry get for helping the farmer.	Corn doesn't Terry get for helping the farmer.	Playing with toys doesn't Terry enjoy doing.	Talking with Max doesn't Terry enjoy doing.	Sewing doesn't Terry enjoy doing.	Football doesn't Terry enjoy doing.	Max asks Terry for help.	A farmer asks Terry for help.	His parents asks Terry for help.	Terry asks Terry for help.
mc500.train.144	A bear such as Eddy.	A bunny such as Eddy.	A dog such as Eddy.	A kitten such as Eddy.	Black color was Eddy.	White color was Eddy.	Orange color was Eddy.	Gray color was Eddy.	Eddy best at was Hopping.	Eddy best at was Playing.	Eddy best at was Climbing.	Eddy best at was Running.	Eddy did most of the day Sit with people.	Eddy did most of the day Sleep, at least 12 hours.	Eddy did most of the day Eat food.	Eddy did most of the day Play with toys.
mc500.train.145	the narrator woof does at the the wolves animal.	the narrator woof does at the the lions animal.	the narrator woof does at the the bears animal.	the narrator woof does at the the penguins animal.	Samson is the bear.	Samson is the Zoo King.	Samson is the narrator.	Samson is the piggy.	the narrator feeds Samson Mustard Jars.	the narrator feeds Samson pig food.	the narrator feeds Samson pork chops.	the narrator feeds Samson restaurant food.	the Zoo, called Mustard Zoo.	the Zoo, called Blue Street Zoo.	the Zoo, called Zoo King.	the Zoo, called Samson Zoo.
mc500.train.146	Tony made for dinner spices.	Tony made for dinner bread.	Tony made for dinner spaghetti.	Tony made for dinner sauce.	the kitten's is name Tony.	the kitten's is name Ar lo.	the kitten's is name Jack.	the kitten's is name Marbles.	Tony did at the park walk and talk.	Tony did at the park play.	Tony did at the park feel.	Tony did at the park laid.	Tony do righted after dinner sleep.	Tony do righted after dinner cook.	Tony do righted after dinner clean.	Tony do righted after dinner feed Marbles.
mc500.train.147	Woofing ton delivered the message to Mort y Roo because Woofing ton liked to be a good dog.	Woofing ton delivered the message to Mort y Roo because Woofing ton wanted Mort y Roo to like him.	Woofing ton delivered the message to Mort y Roo because Woofing ton had a special respect for spiders because they eat bugs that could bite him and make him sick.	Woofington would allow Woofington to chase Morty Roo around the neighborhood.	A blue spider such as Mort y Roo.	An orange cat such as Mort y Roo.	A pink spider such as Mort y Roo.	A neighborhood dog such as Mort y Roo.	Twinkle was afraid that people might think he was a girl since he was pink.	Twinkle was afraid Morty Roo would mistake him for another spider and eat him.	Twinkle was afraid he would n't like being pink.	Twinkle was afraid his new skin would n't fit.	must a spider get rid of its old skin because To hide from friends.	must a spider get rid of its old skin because To grow a new, larger skin.	must a spider get rid of its old skin because Because he is bored.	must a spider get rid of its old skin because To change colors.
mc500.train.148	Danny the dog saw Fanny earlier.	Freddy the frog saw Fanny earlier.	Colin the cat saw Fanny earlier.	Allen the alligator saw Fanny earlier.	Danny the dog had for dessert Fruit and pie.	Danny the dog had for dessert Ice cream and pie.	Danny the dog had for dessert Fruit and cupcake.	Danny the dog had for dessert Cupcake and ice cream.	Fanny bought at the store Meatballs, rice, and fruit.	Fanny bought at the store Fruit, garlic, and meatballs.	Fanny bought at the store Ice cream, tomato sauce, and garlic.	Fanny bought at the store Ice cream, fruit, and pasta.	Fanny saw at the store Allen and alligator.	Fanny saw at the store Danny the dog.	Fanny saw at the store Freddy the frog.	Fanny saw at the store Colin the cat.
mc500.train.149	God did Sam first ask for his phone.	Brother did Sam first ask for his phone.	Mom did Sam first ask for his phone.	Sister did Sam first ask for his phone.	name of the person who had lost the phone was Sam.	name of the person who had lost the phone was John.	name of the person who had lost the phone was Pat.	name of the person who had lost the phone was Lucy.	Sam found the phone on While playing.	Sam found the phone on While doing chores.	Sam found the phone on While sitting in the kitchen.	Sam found the phone on While praying before bed.	Sam wanted Toy.	Sam wanted Bat.	Sam wanted Phone.	Sam wanted Ball.
mc500.train.150	Sam's dog's is name Buttons.	Sam's dog's is name Rocky.	Sam's dog's is name Sam.	Sam's dog's is name Chris.	Red color is Sam's dog.	Yellow color is Sam's dog.	Brown color is Sam's dog.	White color is Sam's dog.	Rocky is mean	Rocky is sad	Rocky is happy	Rocky is scared	Sam feel about where he does is going Angry.	Sam feel about where he does is going Sad.	Sam feel about where he does is going Worried.	Sam feel about where he does is going Happy.
mc500.train.151	Jack ate for breakfast pear.	Jack ate for breakfast eggs.	Jack ate for breakfast cereal.	Jack ate for breakfast apple.	Jack watched on TV the news.	Jack watched on TV the weather.	Jack watched on TV cooking show.	Jack watched on TV sports.	Jack made hot dogs on next week.	Jack made hot dogs on today.	Jack made hot dogs on Sunday.	Jack made hot dogs on Saturday.	Jack start cleaning after lunched in backyard.	Jack start cleaning after lunched in kitchen.	Jack start cleaning after lunched in living room.	Jack start cleaning after lunched in bathroom.
mc500.train.152	Jim found in his pocket Kitty.	Jim found in his pocket Flashlight.	Jim found in his pocket String.	Jim found in his pocket Wood.	name of the giant was Bilbo.	name of the giant was Bob.	name of the giant was Pizza.	name of the giant was Jim.	name of Jim's kitty was Jim.	name of Jim's kitty was Steve.	name of Jim's kitty was Bob.	name of Jim's kitty was Adam.	Jim wanted to eat Carrots.	Jim wanted to eat Pizza.	Jim wanted to eat Hot Dog.	Jim wanted to eat Hamburger.
mc500.train.153	the friends went after arriving at the mall in Ben and Sasha went to the sporting goods store, and June and Bruce went to a movie.	the friends went after arriving at the mall in Bruce and June went to the sporting goods store, and Ben and Sasha went to a movie.	the friends went after arriving at the mall in Ben and Bruce went to the sporting goods store, and June and Sasha went to a movie.	the friends went after arriving at the mall in Bruce and Sasha went to the sporting goods store, and Ben and June went to a movie.	June time of year did the story take place.	October time of year did the story take place.	July time of year did the story take place.	May time of year did the story take place.	Ben, Margaret, Sasha, and Bruce went to the mall.	Ben, Maggie, Sasha, and Bruce went to the mall.	Ben, June, Sasha, and Bruce went to the mall.	Ben, Molly, Sasha, and Bruce went to the mall.	Bruce scraped another car when backing out of the parking spot, and Ben and Sasha got in trouble for stealing happened after the friends left the mall.	June scraped another car when backing out of the parking spot, and Ben and Sasha got in trouble for stealing happened after the friends left the mall.	Ben scraped another car when backing out of the parking spot, and June and Sasha got in trouble for stealing happened after the friends left the mall.	Sasha scraped another car when backing out of the parking spot, and Bruce and Ben got in trouble for stealing happened after the friends left the mall.
mc500.train.154	Sparky wanted to give it to Mrs. Han	Sparky wanted to eat it.	Sparky dislikes clean clothes.	Sparky wanted to play.	Mrs. Tomly doing in her was back yard cooking on her grill.	Mrs. Tomly doing in her was back yard playing with Sparky.	Mrs. Tomly doing in her was back yard sleeping on a table.	Mrs. Tomly doing in her was back yard reading a book.	Johnny belonged to Mr. Wilson	Johnny was his favorite sock.	Johnny want the sock backed because His mother had cleaned it.	Johnny belonged to Mrs. Han	the cat point to where the little spotted dog did went with his tail.	the cat point to where the little spotted dog did went with his leg.	the cat point to where the little spotted dog did went with his paw.	the cat point to where the little spotted dog did went with his ear.
mc500.train.155	Mr. Lemon not likes banana and lemon.	Mr. Lemon not likes green mittens.	Mr. Lemon not likes vanilla and chocolate.	Mr. Lemon not likes strawberry and apple.	"Mr. Banana patted Ms. Strawberry on the head and told her ""Not everyone is going to like your cupcakes."	"Mrs. Apple patted Ms. Strawberry on the head and told her ""Not everyone is going to like your cupcakes."	"Mr. Lemon patted Ms. Strawberry on the head and told her ""Not everyone is going to like your cupcakes."	"Ms. Mitten patted Ms. Strawberry on the head and told her ""Not everyone is going to like your cupcakes."	the cupcakes had Banana.	the cupcakes had Strawberry.	the cupcakes had Chocolate.	the cupcakes had Vanilla.	 Ms. Strawberry's cupcake party was that.. evening.	 Ms. Strawberry's cupcake party was that.. night.	 Ms. Strawberry's cupcake party was that.. afternoon.	 Ms. Strawberry's cupcake party was that.. morning.
mc500.train.156	Max thought of the snow That it was made of powder.	Max thought of the snow That the farmer was mad.	Max thought of the snow That it tasted good.	Max thought of the snow That it was cold and pretty.	the cow's was name Max.	the cow's was name Henry.	the cow's was name Omaha.	the cow's was name Bob.	The Farmer told Max that it was snow.	The Rooster told Max that it was snow.	The Spider told Max that it was snow.	Another cow told Max that it was snow.	Max left the barn because Because his mom told him to.	Max was time for supper.	Max left the barn because The Farmer told him to go outside.	Max wanted to know why the ground was bright outside.
mc500.train.157	Johnny met Johnny did not meet a dinosaur.	Johnny met A friendly dinosaur.	Johnny met A sleepy dinosaur.	Johnny met A T-Rex.	Johnny pushed the button that said `` present. ''	Johnny pushed the button that said `` space. ''	Johnny did not push a button.	Johnny pushed the button that said `` past. ''	the time machine looked like A silver ice-cream cone with a round hole.	the time machine looked like A silver triangle with a square hole.	the time machine looked like A silver ice-cream cone with a square hole.	the time machine looked like A silver triangle with a round hole.	the three buttons said Present, space, and Dimension X.	the three buttons said There were more than three buttons.	the three buttons said Past, present and now.	the three buttons said Past, present and space.
mc500.train.158	Michael's dad taught him about throwing a football How to hold the football with both hands and keep his eyes wide open when he threw the football.	Michael's dad taught him about throwing a football How to put his fingers on the laces and how to keep his shoulder and the football in a straight line before he threw it.	Michael's dad taught him about throwing a football How to use his wrist to throw the football straight and how to close one eye before he threw it.	Michael's dad taught him about throwing a football How to look at the tire before he threw the football and how to stand up straight.	name of the main character in the story was Joe.	name of the main character in the story was Nick.	name of the main character in the story was Ryan.	name of the main character in the story was Michael.	Michael sat with on the bus Joe.	Michael sat with on the bus Ryan.	Michael sat with on the bus Nick.	Michael sat with on the bus his teacher.	Michael's favorite food was carrots.	Michael's favorite food was milk.	Michael's favorite food was Corn.	Michael's favorite food was Hot dogs.
mc500.train.159	Bobby finds in his room A leprechaun.	Bobby finds in his room Bigfoot.	Bobby finds in his room A mermaid.	Bobby finds in his room An angel.	No one can Bobby tell about the angel.	His grandma can Bobby tell about the angel.	His mother can Bobby tell about the angel.	His brother can Bobby tell about the angel.	Bobby beat the angel does at the Cards games.	Bobby beat the angel does at the Rock-paper-scissors games.	Bobby beat the angel does at the Checkers games.	Bobby beat the angel does at the Chess games.	White color is the angel's wings not.	Green color is the angel's wings not.	Red color is the angel's wings not.	Blue color is the angel's wings not.
mc500.train.160	Linda is going to miss doing Swim with her friend Lilly.	Linda is going to miss doing See the Eiffel Tower with her friend Lilly.	Linda is going to miss doing See movies with her friend Lilly.	Linda is going to miss doing Play Baseball with her friend Lilly.	Linda thought she 'd get lost.	Linda would n't know how to order food.	Linda worried about the fact that she couldn't speak French because Everyone might make fun of her.	Linda wanted to make friends with the people there.	summer is in Spain.	summer is in Italy.	summer is in England.	summer is in France.	was Linda feeling on the last day of school Nervous.	was Linda feeling on the last day of school Excited.	was Linda feeling on the last day of school Worried.	was Linda feeling on the last day of school Happy.
mc500.train.161	His parents brought out cake for him happened when Jon woke up.	Jon saw his parents brushing their teeth	His parents were still asleep so he had to go back to sleep happened when Jon woke up.	Jon opened his presents when his parents were still sleeping	Jon really wanted A pair of pants.	Jon really wanted ice cream.	Jon really wanted A picture of his favorite basketball player.	Jon really wanted Basketball.	Jon ate cake and wanted to play with his new ball	Jon ate ice cream and went outside to play	Jon ate pizza and finished opening the rest of his gifts	Jon ate chips and went back to sleep	Jon got two gifts.	Jon got one gifts.	Jon got four gifts.	Jon got three gifts.
mc500.train.162	the boy's favorite TV shows is Fido & Jimmy.	the boy's favorite TV shows is Flintstones & Scooby Doo.	the boy's favorite TV shows is Mom & Jimmy.	the boy's favorite TV shows is Seinfeld & King of the Hill.	Jimmy was happy and wanted to go outside every day after school.	Jimmy wanted to watch television again.	Jimmy wanted to eat a snack.	Jimmy wanted to play with Fido.	Jimmy's dog , called Scooby Doo.	Jimmy's dog , called Fido.	Jimmy's dog , called Jimmy.	Jimmy's dog , called Flint stone.	the boy's is name Mom.	the boy's is name Flintstones.	the boy's is name Scooby Doo.	the boy's is name Jimmy.
mc500.train.163	Two o'clock time was Chris coming over.	This morning time was Chris coming over.	Twelve o'clock time was Chris coming over.	Tonight time was Chris coming over.	Nick and Chris both liked to do Draw pictures and paint.	Nick and Chris both liked to do Read books.	Nick and Chris both liked to do Eat lunch.	Nick and Chris both liked to do Ride bikes and play games.	His grandfather was Nick going to meet for this first time.	His cousin was Nick going to meet for this first time.	His grandmother was Nick going to meet for this first time.	His aunt was Nick going to meet for this first time.	Nick surprised because Chris liked the same things as him.	Nick fell asleep.	Nick surprised because Chris was a girl.	Nick surprised because Chris was his cousin.
mc500.train.164	Jill prefer ed Science.	Jill prefer ed Art.	Jill prefer ed History.	Jill prefer ed Math.	Jill not do to were ready for the test Made a cheat sheet with the test answers.	Jill not do to were ready for the test Got lots of sleep the night before.	Jill not do to were ready for the test Woke up early and had breakfast.	Jill not do to were ready for the test Studied hard the whole week.	Jill studied with her friend in At the library.	Jill studied with her friend in At school.	Jill studied with her friend in At the park.	Jill studied with her friend in At her house.	Jill failed a test.	Jill fought with Michelle.	Jill was grounded.	Jill lost a library book.
