mc500.train.230	Cupid 's one of the reindeer games.	Cupid is looking for noodles.	Cupid is looking for cheese so he can make pizza.	Cupid is looking for water to splash around.	Rudolph wins all the games.	Donner wins all the games.	Cupid wins all the games.	Comet wins all the games.	Cupid likes to get wet in the pool.	Rudolph likes to get wet in the pool.	Comet likes to get wet in the pool.	Donner likes to get wet in the pool.	Donner wins all the reindeer games.	Donner the best at flying because Because he practices riding the wind in his off time.	Donner splashes around in the pool.	Donner eats cheese.
mc500.train.231	Kevin and Erin did in New York City FIRST Visited the Empire State Building.	Kevin and Erin did in New York City FIRST Went to their hotel.	Kevin and Erin did in New York City FIRST Went to Central Park.	Kevin and Erin did in New York City FIRST Saw the Statue of Liberty.	Kevin and Erin eat for breakfast when they did went to the diner cereal.	Kevin and Erin eat for breakfast when they did went to the diner pancakes.	Kevin and Erin eat for breakfast when they did went to the diner eggs.	Kevin and Erin eat for breakfast when they did went to the diner oatmeal.	dinner that did Kevin have with Erin in New York is chocolate.	dinner that did Kevin have with Erin in New York is steak.	dinner that did Kevin have with Erin in New York is eggs.	dinner that did Kevin have with Erin in New York is pancakes.	Erin lived in United States.	Erin lived in England.	Erin lived in Australia.	Erin lived in New York.
mc500.train.232	John shouting about that his was mother heard Helmets.	John shouting about that his was mother heard Roads.	John shouting about that his was mother heard Wheels.	John shouting about that his was mother heard Bicycles.	Sam started racing Sam started when he saw a race on tv.	Sam started racing Sam started with his father when he was younger.	Sam started racing Sam started with his mother.	Sam started racing Sam started when he met Mark.	 Sam for 200. said he would give John his old bike, and for how much.	 Mark, for 100. said he would give John his old bike, and for how much.	Sam, for free said he would give John his old bike, and for how much.	David for free said he would give John his old bike, and for how much.	John was driving the car and he was going home was driving the car and where was he going.	David was driving the car to the store was driving the car and where was he going.	Sam was driving the car to the store was driving the car and where was he going.	Mark was driving the car and he was going home was driving the car and where was he going.
mc500.train.233	homework is in in his room.	homework is in At Jacob's house.	homework is in on TV.	homework is in outside.	William been doing homework has Sunset.	William been doing homework has Overnight.	William been doing homework has Early spring.	William been doing homework has Since kindergarten.	at Jacob's house that William liked to was play with a dog.	at Jacob's house that William liked to was play with a TV.	at Jacob's house that William liked to was play with An RC car.	at Jacob's house that William liked to was play with junk food.	before his parents would let him go to Jacob's house Eat junk food.	before his parents would let him go to Jacob's house tell jokes.	before his parents would let him go to Jacob's house His homework.	before his parents would let him go to Jacob's house watch TV.
mc500.train.234	Green color was the flower that made Mary sick.	Red color was the flower that made Mary sick.	Orange color was the flower that made Mary sick.	Purple color was the flower that made Mary sick.	Mary loves to eat Grass.	Mary loves to eat Purple flowers.	Mary loves to eat Dirt.	Mary loves to eat Weeds.	Mary ate dirt	Mary had to take a nap	Mary ate weeds	Mary was stung by a bee	Her brother Sam asked Mary why she was sick.	Her brother Donny asked Mary why she was sick.	Her dad asked Mary why she was sick.	Her mom asked Mary why she was sick.
mc500.train.235	Emilia call her mothered because to find how how to get Elise to eat her broccoli.	Emilia call her mothered because to ask what she was having for suppertime.	Emilia call her mothered because to talk.	Emilia call her mothered because to ask how to cook broccoli.	Emilia called on the phone the store's clerk where she bought the broccoli.	Emilia called on the phone her son.	Emilia called on the phone her daughter, Elise.	Emilia called on the phone Her mother.	Emilia pick ups off the floor a piece of broccoli.	Emilia pick ups off the floor a telephone.	Emilia pick ups off the floor a pacifier.	Emilia pick ups off the floor a twig.	Elise always ate her broccoli at the end of the story because her grandmother said they were good for her.	Elise always ate her broccoli at the end of the story because her mother asked her nicely.	Elise thought they were small trees	Elise always ate her broccoli at the end of the story because Elise saw her brother eating it at last night's dinner.
mc500.train.236	the boy do when he couldn't caught the butterfly He started to cry.	the boy do when he couldn't caught the butterfly He started flying after it.	the boy do when he couldn't caught the butterfly He clapped his hands.	the boy do when he couldn't caught the butterfly He left the park with a sad look on his face.	 Was there more than one butterfly in the park Yes, there were many.	 Was there more than one butterfly in the park No, it was the only one in there.	 Was there more than one butterfly in the park There were no butterflies in the park.	 Was there more than one butterfly in the park There were two in the park.	the butterfly did when it got scared It bit the boy.	the butterfly did when it got scared It stayed still.	the butterfly did when it got scared It called the other butterflies over.	the butterfly did when it got scared It flew very fast and very high in the air.	the little boy want to did with the butterfly He wanted to show it to his friends.	the little boy want to did with the butterfly He wanted to chase it.	the little boy want to did with the butterfly He wanted to play a game with it.	the little boy want to did with the butterfly He wanted to put it in his pocket.
mc500.train.237	eight at night time is it.	Six in the morning time is it.	eight in the morning time is it.	six at night time is it.	the Dad play football in high schooled because the coach made him.	Dad did n't play football	the Dad play football in high schooled because To marry Mom.	the Dad play football in high schooled because for fun.	the son not picked soccer ball.	the son not picked baseball.	the son not picked bowling ball.	the son not picked football.	the dad want to did before high school play soccer.	the dad want to did before high school play football.	the dad want to did before high school watch movies.	the dad want to did before high school juggle in the circus.
mc500.train.238	Pink color is John's favorite shirt.	Green color is John's favorite shirt.	Red color is John's favorite shirt.	Blue color is John's favorite shirt.	John did before washing his hands Fed his dog.	John did before washing his hands Gave Emily her pacifier.	John did before washing his hands Ate breakfast.	John did before washing his hands Played Trouble.	John take Bentley to play fetched in Front yard.	John take Bentley to play fetched in Living Room.	John take Bentley to play fetched in Backyard.	John take Bentley to play fetched in Kitchen.	John and Bentley came inside because Breakfast was ready.	John and Bentley came inside because Emily began to cry.	John began to rain	John and Bentley came inside because Dad wanted to play a game.
mc500.train.239	Maggie's favorite place to sleep was in in the backyard.	Maggie's favorite place to sleep was in on her purple cat bed.	Maggie's favorite place to sleep was in on her family's lap.	Maggie's favorite place to sleep was in on the street.	Maggie lived in a farm with other animals.	Maggie lived in a box on the street.	Maggie lived in a house downtown.	Maggie lived in an apartment in the city.	Maggie lived on the street	the other cats teasing Maggie because because she was lucky.	the other cats teasing Maggie because because she was so big.	Maggie lived in an apartment	Maggie was alone.	Maggie had a backyard to play in	Maggie had a lot of money.	Maggie was free to go where ever she wanted.
mc500.train.240	black color is Josh's hair.	brown color is Josh's hair.	yellow color is Josh's hair.	red color is Josh's hair.	Maggie went too fast down a hill	Maggie put a card in the spokes of her bike.	Maggie lied to her father	Maggie ran into a trashcan	Maggie told her that he loved her	Maggie could not remember what happened	Maggie put a card in the spokes of her bike	Maggie was afraid to tell him the truth	Maggie put a card in the wheel of her bike because To smell bad.	Maggie put a card in the wheel of her bike because To lie to her father.	Maggie put a card in the wheel of her bike because To have fun.	Maggie put a card in the wheel of her bike because To make it sound fast.
mc500.train.241	names of Mitchell and Graham's friends are Jimmy and Justin.	names of Mitchell and Graham's friends are Justin and Graham.	names of Mitchell and Graham's friends are Mitchell and Justin.	names of Mitchell and Graham's friends are Mitchell and Jimmy.	Mitchell and Graham saw their friends first in On the way to the store.	Mitchell and Graham saw their friends first in At their house.	Mitchell and Graham saw their friends first in The store.	Mitchell and Graham saw their friends first in The lemonade stand.	the boys get more people to bought their lemonade Create a sign.	the boys get more people to bought their lemonade Tell people walking by.	the boys get more people to bought their lemonade Asking their friends to help.	the boys get more people to bought their lemonade Telling their friends to start their own stand.	the boys share the money they did made Mitchell took all the money.	the boys share the money they did made They split it.	the boys share the money they did made They didn't make any money.	the boys share the money they did made Graham took all the money.
mc500.train.242	brown and yellow color were the most ducklings.	yellow color were the most ducklings.	brown color were the most ducklings.	white color were the most ducklings.	David's favorite thing at the pond was boat.	David's favorite thing at the pond was duckling.	David's favorite thing at the pond was water lily.	David's favorite thing at the pond was frog.	the children came to see frog.	the children came to see ducklings.	the children came to see cake.	the children came to see boat.	Sue got for Auntie Beth eggs.	Sue got for Auntie Beth flour.	Sue got for Auntie Beth milk.	Sue got for Auntie Beth butter.
mc500.train.243	Frank, the knight, used as a weapon Knife.	Frank, the knight, used as a weapon Freeze.	Frank, the knight, used as a weapon Sword.	Frank, the knight, used as a weapon Staff.	Frank try to do that Bobby did didn't like Jump.	Frank try to do that Bobby did didn't like Dance.	Frank try to do that Bobby did didn't like Sing.	Frank try to do that Bobby did didn't like Fly.	Bobby was Knight.	Bobby was Witch.	Bobby was Frog.	Bobby was Wizard.	Fly spell did Bobby use that Frank didn't like.	Freeze spell did Bobby use that Frank didn't like.	Trap spell did Bobby use that Frank didn't like.	Heal spell did Bobby use that Frank didn't like.
mc500.train.244	Jack when he saw the pond with ducks in it was in park.	Jack when he saw the pond with ducks in it was in store.	Jack when he saw the pond with ducks in it was in home.	Jack when he saw the pond with ducks in it was in school.	Noodle eat that made his bellied hurt bones.	Noodle eat that made his bellied hurt beef.	Noodle eat that made his bellied hurt chicken.	Noodle eat that made his bellied hurt ladybug.	Puff saw at the park stick.	Puff saw at the park ducks.	Puff saw at the park ladybug.	Puff saw at the park mouse.	Polly ate bones.	Polly ate milk.	Polly ate beef.	Polly ate chicken noodle soup.
mc500.train.245	the rain has forced him to stay inside has made the little boy sad.	he wants a puppy has made the little boy sad.	he doesn't want to eat his vegetable has made the little boy sad.	he has to go to bed has made the little boy sad.	mommy does do when she sees Conner outside mommy tells him to come in and takes away his rain boots.	mommy does do when she sees Conner outside Nothing mommy never saw him outside.	mommy does do when she sees Conner outside smiles and joins him in his play.	mommy does do when she sees Conner outside mommy shuts the sliding door.	the little boys is name outside.	the little boys is name Conner.	the little boys is name mommy.	the little boys is name Rain.	the Conner does do when he goes outside takes off his rain boots.	the Conner does do when he goes outside Conner runs away.	the Conner does do when he goes outside Conner falls and hurts himself.	the Conner does do when he goes outside runs from puddle to puddle splashing in them.
mc500.train.246	Amelia loves to do think.	Amelia loves to do write.	Amelia loves to do garden.	Amelia loves to do sing.	Amelia had to feed her cow Daisy	Amelia stayed in the garden because to wait for her mother.	Amelia stayed in the garden because to pet her frog.	Amelia stayed in the garden because to try and think of a song to write.	Amelia sat in the garden all day Monday.	Amelia sat in the garden three days.	Amelia sat in the garden two days.	Amelia sat in the garden Saturday afternoon.	the princess, called Pete.	the princess, called Amelia.	the princess, called Daisy.	the princess, called Anne.
mc500.train.247	John felt about clapping Happy.	John felt about clapping Excited.	John felt about clapping Sad.	John felt about clapping Scared.	John cl aped on All the time.	John cl aped on When he was Happy.	John cl aped on When he scared.	John cl aped on When he was sad.	long could John clap A Month.	long could John clap A week.	long could John clap a day.	long could John clap a weekend.	Sam was annoyed by John's clapping.	John was annoyed by John's clapping.	Zoo was annoyed by John's clapping.	Magic Clown was annoyed by John's clapping.
mc500.train.248	Bob fell on the ice on Sunday.	Bob fell on the ice on Tuesday.	Bob fell on the ice on Monday.	Bob fell on the ice on Friday.	Bob rode his bike home because he wanted to get yogurt in Tuesday.	Bob rode his bike home because he wanted to get yogurt in Sunday.	Bob rode his bike home because he wanted to get yogurt in Monday.	Bob rode his bike home because he wanted to get yogurt in Friday.	Matt looking around in the fridge was on Sunday.	Matt looking around in the fridge was on Tuesday.	Matt looking around in the fridge was on Monday.	Matt looking around in the fridge was on Friday.	Matt played with cat.	Matt played with mouse.	Matt played with dog.	Matt played with duck.
mc500.train.249	the elf hides in The kitchen.	the elf hides in The children's book bags.	the elf hides in In an alarm clock.	the elf hides in A bush.	the elf in front of the door because He was looking at doors for fun.	the elf in front of the door because He was working for the Tooth Fairy and no one had let him in.	the elf in front of the door because He liked the color of the door.	the elf in front of the door because He was glued to the ground.	The children does the elf work for.	The North Pole does the elf work for.	The Tooth Fairy does the elf work for.	The Humans does the elf work for.	The children see him help the Tooth Fairy on his first day of work.	Alarm clocks go off help the Tooth Fairy on his first day of work.	No one let him in help the Tooth Fairy on his first day of work.	Tooth 'll work in the North Pole
mc500.train.250	the monkey get a stomach ached because the pill was bad for the monkey.	the monkey get a stomach ached because the napkin was made from straw which is not good for monkeys.	the monkey get a stomach ached because the monkey was sad.	the monkey get a stomach ached because the zebra punched the monkey.	the monkey eats instead of napkins zebra steak.	the monkey eats instead of napkins bananas.	the monkey eats instead of napkins a cheese sandwich.	the monkey eats instead of napkins a pill.	the zebra eats bananas.	the zebra eats pancakes.	the zebra eats napkins.	the zebra eats a pill.	the zoo worker gave the monkey a pill made the monkey feel better.	the zebra gave the monkey another napkin made the monkey feel better.	the zoo worker gave the monkey a banana made the monkey feel better.	the zoo worker told the monkey a joke made the monkey feel better.
mc500.train.251	Boots fell asleep	Boots rode in the boat	Boots got very muddy at the lake	Boots got cake on him	Justine's dog's was name Boots.	Justine's dog's was name Janice.	Justine's dog's was name Moore.	Justine's dog's was name Greg.	the girls fell asleep quickly because They had eaten cake.	the girls fell asleep quickly because They woke up early in the morning.	the girls fell asleep quickly because They rode in the boat.	the girls fell asleep quickly because They were so active during the day.	Boots' favorite thing to was do at the lake Fetch sticks from the water.	Boots' favorite thing to was do at the lake Ride in the boat.	Boots' favorite thing to was do at the lake Ride in the tube.	Boots' favorite thing to was do at the lake Swim in the water.
mc500.train.252	Timmy wanted his friends to try fish.	Timmy wanted his friends to try pizza.	Timmy wanted his friends to try Soup.	Timmy wanted his friends to try burgers.	Timmy and his friends loved soup.	Timmy and his friends loved turkey.	Timmy and his friends loved pizza.	Timmy and his friends loved fish.	Timmy went to Kroger because to buy meat.	Timmy went to Kroger because to see John.	Timmy went to Kroger because to drink lemonade.	Timmy went to Kroger because to eat soup.	name of John's grandson was David.	name of John's grandson was Timmy.	name of John's grandson was Bill.	name of John's grandson was Roger.
mc500.train.253	one of Yolanda's favorite things to is do To look at the shapes of dogs.	one of Yolanda's favorite things to is do To look at the shapes of boats.	one of Yolanda's favorite things to is do To look at the shapes of backyards.	one of Yolanda's favorite things to is do To look at the shapes of the clouds.	Yolanda saw in the clouds A garden and a dog.	Yolanda saw in the clouds A flower, boat, and butterfly.	Yolanda saw in the clouds A spider, boat, and dog.	Yolanda saw in the clouds A flower, boat, and dog.	Yolanda want to becomes someday and why A real scientist, so she can learn all about building houses and backyards.	Yolanda want to becomes someday and why A real scientist, so she can study medicine.	Yolanda want to becomes someday and why A real scientist, so she can learn all about plants, bugs and nature.	Yolanda want to becomes someday and why A gardener, so she can learn all about plants, bugs and nature.	the backyard does garden do Brings bugs into Yolanda's house.	the backyard does garden do Makes shapes like flowers, boats, and dogs.	the backyard does garden do Brings in birds and clouds.	the backyard does garden do Makes the yard look beautiful, smell wonderful, brings in birds and insects.
mc500.train.254	Jess traded for the bowl A ticket to Heaven.	Jess traded for the bowl A box of cereal.	Jess traded for the bowl Her wings.	Jess traded for the bowl A seesaw.	Tony laughed at her	Tony traded with her	Tony sent her away	Tony argued with her	Jess wanted Wings.	Jess wanted A box of cereal.	Jess wanted A seesaw.	Jess wanted A golden bowl.	An angel was Tony.	A leprechaun was Tony.	A cereal maker was Tony.	A bird was Tony.
mc500.train.255	the cat, called Dig.	the cat, called Mittens.	the cat, called Pizza.	the cat, called Bub.	Dig made the noise that caused the sock monster to look at the friends.	Bub made the noise that caused the sock monster to look at the friends.	Mittens made the noise that caused the sock monster to look at the friends.	Pizza made the noise that caused the sock monster to look at the friends.	the sock monster ate banana.	the sock monster ate grape.	the sock monster ate apple.	the sock monster ate pear.	the dog, called Dig.	the dog, called Pizza.	the dog, called Mittens.	the dog, called Bub.
mc500.train.256	the secret Jack was known about Goose that laid eggs filled with golden coins.	the secret Jack was known about A hat.	the secret Jack was known about Bean roots.	the secret Jack was known about Golden Guitar.	Jack went after the giant dropped him in To the restroom.	Jack went after the giant dropped him in To get the goose.	Jack went after the giant dropped him in To play the golden guitar.	Jack went after the giant dropped him in Down the beanstalk and to the little people world.	the giant eating was An egg.	the giant eating was A root.	the giant eating was Ham sandwich.	the giant eating was Some ice cream.	the giant hid the bean roots in The store.	the giant hid the bean roots in The library.	the giant hid the bean roots in In the ham.	the giant hid the bean roots in The little people world.
mc500.train.257	Quinton going to be is back at school on never.	Quinton going to be is back at school on after lunch.	Quinton going to be is back at school on next week.	Quinton going to be is back at school on tomorrow.	Quinton's mother has waiting for them cake.	Quinton's mother has waiting for them cookies and milk.	Quinton's mother has waiting for them ice cream.	Quinton's mother has waiting for them macaroni and cheese.	Kendra make sure to leave in times for school.	Kendra make sure to leave in times for breakfast.	Kendra make sure to leave in times for bedtime.	Kendra make sure to leave in times for dinner.	They live the same distance from the bus stop lives further from the bus stop.	Quinton lives further from the bus stop lives further from the bus stop.	Neither of them live further from the bus stop lives further from the bus stop.	Kendra lives further from the bus stop lives further from the bus stop.
mc500.train.258	Grandma holding when she was was standing at the door Cookies.	Grandma holding when she was was standing at the door Lemonade.	Grandma holding when she was was standing at the door Sandwiches.	Grandma holding when she was was standing at the door Chips.	Green color was Timmy's toy car.	Brown color was Timmy's toy car.	White color was Timmy's toy car.	Blue color was Timmy's toy car.	board games bring with him to his grandma's house.	his puzzle bring with him to his grandma's house.	his dog bring with him to his grandma's house.	his car bring with him to his grandma's house.	the last thing Grandma and Timmy was did Ate lunch.	the last thing Grandma and Timmy was did Played with the car.	the last thing Grandma and Timmy was did Sat on the porch.	the last thing Grandma and Timmy was did Put together the puzzle.
mc500.train.259	Joe like to visit his grandmother because There are things there that are not found in cities.	Joe like to visit his grandmother because Clarissa is a very good cook.	Joe like to visit his grandmother because His parents might buy him something that he likes.	Joe like to visit his grandmother because Max and Joe enjoy scaring the cows.	Joe's grandmother's dog , called Tony.	Joe's grandmother's dog , called Joe.	Joe's grandmother's dog , called Max.	Joe's grandmother's dog , called Hazel.	Joe's grandmother's is name Hazel.	Joe's grandmother's is name Clarissa.	Joe's grandmother's is name Max.	Joe's grandmother's is name Tony.	near Joe's grandmother's are house cities.	near Joe's grandmother's are house balls.	near Joe's grandmother's are house animals.	near Joe's grandmother's are house stores.
mc500.train.260	the mom in the story, called Maggie.	the mom in the story, called Tiffany.	the mom in the story, called Jan.	the mom in the story, called Taylor.	in the bag that the dentist was given to Maggie toothbrush, toothpaste, candy, and sticker.	in the bag that the dentist was given to Maggie toothbrush and toys.	in the bag that the dentist was given to Maggie toothbrush, toothpaste, and candy.	in the bag that the dentist was given to Maggie toothbrush and toothpaste.	they saw at the dentist's office three different people.	they saw at the dentist's office one different people.	they saw at the dentist's office seven different people.	they saw at the dentist's office two different people.	Maggie and Jan went in to the toy store.	Maggie and Jan went in to the candy store.	Maggie and Jan went in to the doctor.	Maggie and Jan went in to the dentist.
mc500.train.261	Jim looking when he saw the shooting star was in At the sky.	Jim looking when he saw the shooting star was in At his car.	Jim looking when he saw the shooting star was in At his dog.	Jim looking when he saw the shooting star was in At a planet.	Jim see lasted year A shooting star.	Jim see lasted year A space ship.	Jim see lasted year A planet.	Jim see lasted year A raccoon.	The sun got brighter.	The shooting star got brighter.	The space ship got brighter.	The light in his house got brighter.	Jim when he saw the space ship was in Looking in his back yard.	Jim when he saw the space ship was in Going home from work.	Jim when he saw the space ship was in Eating lunch.	Jim when he saw the space ship was in On the space ship.
mc500.train.262	the main watermelon's is name Watermelon.	the main watermelon's is name Seedy.	the main watermelon's is name Seed.	the main watermelon's is name Green.	Seedy named his best friend Green.	Seedy named his best friend Stripes.	Seedy named his best friend Mom.	Seedy named his best friend Seedy, Jr.	Seedy upset he didn't have any seeds because His mom said she loved him.	Seedy was lonely.	Seedy felt left out and did n't know why he was different.	Seedy was green and had stripes.	Seedy says he is not special.	Seedy says she does not love him.	Seedy says he is special and she loves him the way he is.	Seedy says he is green.
